country,source,date,title,summary,agency,url
US,Federal Register,2025-04-21,Air Plan Approval; Indiana; Indiana NOX Emissions Monitoring,"The Environmental Protection Agency (EPA) is proposing to approve under the Clean Air Act (CAA) a request from the Indiana Department of Environmental Management (IDEM) to revise the Indiana State Implementation Plan (SIP) to incorporate revisions to nitrogen oxides (NO<INF>X</INF>) emissions monitoring, reporting and record keeping requirements for new and existing large non-Electric Generating Units (non-EGUs) affected by the NO<INF>X</INF> SIP Call. This SIP revision would approve monitoring, reporting, and record keeping requirements that are permissible as alternatives under Federal rules for these sources for purposes of the NO<INF>X</INF> SIP Call.","[{'raw_name': 'ENVIRONMENTAL PROTECTION AGENCY', 'name': 'Environmental Protection Agency', 'id': 145, 'url': 'https://www.federalregister.gov/agencies/environmental-protection-agency', 'json_url': 'https://www.federalregister.gov/api/v1/agencies/145', 'parent_id': None, 'slug': 'environmental-protection-agency'}]",https://www.federalregister.gov/documents/2025/04/21/2025-06617/air-plan-approval-indiana-indiana-nox-emissions-monitoring
US,Federal Register,2025-04-18,Air Plan Approval; West Virginia; Regional Haze State Implementation Plan for the Second Implementation Period,"The Environmental Protection Agency (EPA) is proposing to approve the regional haze State implementation plan (SIP) revision submitted by West Virginia (West Virginia, WV, or the State) on August 12, 2022, to address applicable requirements under the Clean Air Act (CAA) and the EPA's Regional Haze Rule (RHR) for the regional haze program's second implementation period. The EPA is proposing this action pursuant to the CAA. The EPA is also withdrawing its previous proposed rule to disapprove West Virginia's regional haze SIP revision as published in the Federal Register on January 21, 2025.","[{'raw_name': 'ENVIRONMENTAL PROTECTION AGENCY', 'name': 'Environmental Protection Agency', 'id': 145, 'url': 'https://www.federalregister.gov/agencies/environmental-protection-agency', 'json_url': 'https://www.federalregister.gov/api/v1/agencies/145', 'parent_id': None, 'slug': 'environmental-protection-agency'}]",https://www.federalregister.gov/documents/2025/04/18/2025-06608/air-plan-approval-west-virginia-regional-haze-state-implementation-plan-for-the-second
US,Federal Register,2025-04-09,Air Plan Approval; Louisiana; Interstate Transport Requirements for the 2010 SO2 NAAQS,"Pursuant to the Federal Clean Air Act (CAA or the Act), the Environmental Protection Agency (EPA) is proposing to approve the portion of the State Implementation Plan (SIP) submittal from the State of Louisiana demonstrating that the State satisfies the interstate transport requirements of section 110(a)(2)(D)(i)(I), also known as the ""good neighbor"" provision of the CAA, for the 2010 1-hour sulfur dioxide (SO<INF>2</INF>) primary National Ambient Air Quality Standard (NAAQS). The good neighbor provision requires each State's implementation plan contain adequate provisions prohibiting the interstate transport of air pollution in amounts that will contribute significantly to nonattainment, or interfere with maintenance, of a NAAQS in any other State.","[{'raw_name': 'ENVIRONMENTAL PROTECTION AGENCY', 'name': 'Environmental Protection Agency', 'id': 145, 'url': 'https://www.federalregister.gov/agencies/environmental-protection-agency', 'json_url': 'https://www.federalregister.gov/api/v1/agencies/145', 'parent_id': None, 'slug': 'environmental-protection-agency'}]",https://www.federalregister.gov/documents/2025/04/09/2025-05927/air-plan-approval-louisiana-interstate-transport-requirements-for-the-2010-so2-naaqs
US,Federal Register,2025-04-07,Air Plan Approval; Pennsylvania; Redesignation Request and Associated Maintenance Plan for the Liberty-Clairton Area for the 1997 Annual and 2006 24-Hour Fine Particulate Matter Standard and Maintenance Plan for the Allegheny County Area for the 2012 Annual Fine Particulate Matter Standard,"The Environmental Protection Agency (EPA) is proposing to approve a request from the Commonwealth of Pennsylvania to redesignate the Liberty-Clairton, Pennsylvania nonattainment area (Liberty-Clairton Area) to attainment for the 1997 annual and 2006 24-hour fine particulate matter (PM<INF>2.5</INF>) national ambient air quality standards (NAAQS or standard). The EPA is also proposing to approve, as revisions to the Pennsylvania state implementation plan (SIP), the Commonwealth's plan for maintaining the 1997 annual and 2006 24-hour PM<INF>2.5</INF> NAAQS through 2035 for the Liberty-Clairton Area. Additionally, the EPA is proposing to approve the maintenance plan for the Allegheny County, Pennsylvania nonattainment area (Allegheny County Area) for the 2012 annual PM<INF>2.5</INF> NAAQS through 2035. The maintenance plan includes 2017, 2026, and 2035 mobile vehicle emissions budgets (MVEBs) for mobile sources of PM<INF>2.5</INF> and nitrogen oxides (NO<INF>X</INF>) for the Allegheny County Area. The EPA is proposing to find these 2017, 2026, and 2035 MVEBs for PM<INF>2.5</INF> and NO<INF>X</INF> adequate and to approve these MVEBs into the Pennsylvania SIP for transportation conformity purposes. This action does not redesignate the Allegheny County Area to attainment for the 2012 annual PM<INF>2.5</INF> NAAQS, as Pennsylvania withdrew its redesignation request specific to the Allegheny County Area. The redesignation request and maintenance plan were submitted by the Commonwealth of Pennsylvania Department of Environmental Protection (PADEP or Pennsylvania) on behalf of the Allegheny County Health Department (ACHD). This action is being taken under the CAA.","[{'raw_name': 'ENVIRONMENTAL PROTECTION AGENCY', 'name': 'Environmental Protection Agency', 'id': 145, 'url': 'https://www.federalregister.gov/agencies/environmental-protection-agency', 'json_url': 'https://www.federalregister.gov/api/v1/agencies/145', 'parent_id': None, 'slug': 'environmental-protection-agency'}]",https://www.federalregister.gov/documents/2025/04/07/2025-05921/air-plan-approval-pennsylvania-redesignation-request-and-associated-maintenance-plan-for-the
US,Federal Register,2025-04-07,Receipt of Pesticide Petitions Filed for Residues of Pesticide Chemicals in or on Various Commodities-January 2025,This document announces the Agency's receipt of initial filings of pesticide petitions requesting the establishment or modification of regulations for residues of pesticide chemicals in or on various commodities. EPA is hereby providing notice of receipt and opportunity to comment on these petitions.,"[{'raw_name': 'ENVIRONMENTAL PROTECTION AGENCY', 'name': 'Environmental Protection Agency', 'id': 145, 'url': 'https://www.federalregister.gov/agencies/environmental-protection-agency', 'json_url': 'https://www.federalregister.gov/api/v1/agencies/145', 'parent_id': None, 'slug': 'environmental-protection-agency'}]",https://www.federalregister.gov/documents/2025/04/07/2025-05915/receipt-of-pesticide-petitions-filed-for-residues-of-pesticide-chemicals-in-or-on-various
US,Federal Register,2025-04-07,Air Plan Approval; Connecticut; 2017 Base Year Emissions Inventory for the 2015 8-Hour Ozone National Ambient Air Quality Standards,"The Environmental Protection Agency (EPA) is proposing approval of State Implementation Plan (SIP) revisions submitted by the State of Connecticut that relate to the 2015 Ozone National Ambient Air Quality Standards (NAAQS). The SIP revisions are for the Greater Connecticut and the Connecticut portion of the New York-Northern New Jersey-Long Island, NY-NJ-CT ozone nonattainment areas. The intended effect of this action is to propose approval of submittals which include a 2017 base year emissions inventory for the 2015 Ozone National Ambient Air Quality Standard. This action is being taken under the Clean Air Act.","[{'raw_name': 'ENVIRONMENTAL PROTECTION AGENCY', 'name': 'Environmental Protection Agency', 'id': 145, 'url': 'https://www.federalregister.gov/agencies/environmental-protection-agency', 'json_url': 'https://www.federalregister.gov/api/v1/agencies/145', 'parent_id': None, 'slug': 'environmental-protection-agency'}]",https://www.federalregister.gov/documents/2025/04/07/2025-05910/air-plan-approval-connecticut-2017-base-year-emissions-inventory-for-the-2015-8-hour-ozone-national
US,Federal Register,2025-04-04,Significant New Use Rules on Certain Chemical Substances (24-4.5e),"EPA is proposing significant new use rules (SNURs) under the Toxic Substances Control Act (TSCA) for certain chemical substances that were the subject of premanufacture notices (PMNs) and are also subject to an Order issued by EPA pursuant to TSCA. The SNURs require persons who intend to manufacture (defined by statute to include import) or process any of these chemical substances for an activity that is proposed as a significant new use by this rulemaking to notify EPA at least 90 days before commencing that activity. The required notification initiates EPA's evaluation of the conditions of that use for that chemical substance. In addition, the manufacture or processing for the significant new use may not commence until EPA has conducted a review of the required notification, made an appropriate determination regarding that notification, and taken such actions as required by that determination.","[{'raw_name': 'ENVIRONMENTAL PROTECTION AGENCY', 'name': 'Environmental Protection Agency', 'id': 145, 'url': 'https://www.federalregister.gov/agencies/environmental-protection-agency', 'json_url': 'https://www.federalregister.gov/api/v1/agencies/145', 'parent_id': None, 'slug': 'environmental-protection-agency'}]",https://www.federalregister.gov/documents/2025/04/04/2025-05480/significant-new-use-rules-on-certain-chemical-substances-24-45e
US,Federal Register,2025-04-02,Air Plan Revision; California; Placer County Air Pollution Control District; New Source Review,"The Environmental Protection Agency (EPA) is proposing to approve a revision to the Placer County Air Pollution Control District (PCAPCD or ""District"") portion of the California State Implementation Plan (SIP). This revision concerns the District's Clean Air Act (CAA or ""Act"") nonattainment new source review permitting program that regulates construction and modifications of major stationary sources of air pollution in nonattainment areas. We are proposing to approve a local rule that has been revised to address deficiencies previously identified by the EPA in a prior action that included a limited approval/limited disapproval of a prior version of the rule. We are taking comments on this proposal and plan to follow with a final action. Elsewhere in this Federal Register, we are making an interim final determination that will defer the imposition of CAA sanctions associated with our previous limited disapproval.","[{'raw_name': 'ENVIRONMENTAL PROTECTION AGENCY', 'name': 'Environmental Protection Agency', 'id': 145, 'url': 'https://www.federalregister.gov/agencies/environmental-protection-agency', 'json_url': 'https://www.federalregister.gov/api/v1/agencies/145', 'parent_id': None, 'slug': 'environmental-protection-agency'}]",https://www.federalregister.gov/documents/2025/04/02/2025-05375/air-plan-revision-california-placer-county-air-pollution-control-district-new-source-review
US,Federal Register,2025-03-31,Section 610 Review of National Emission Standards for Hazardous Air Pollutants for Brick and Structural Clay Products Manufacturing and Clay Ceramics Manufacturing,"Pursuant to section 610 of the Regulatory Flexibility Act, the Environmental Protection Agency (EPA) is announcing the review of the National Emission Standards for Hazardous Air Pollutants for Brick and Structural Clay Products Manufacturing; and Clay Ceramics Manufacturing (Brick and Clay 610 Review). As part of this review, the EPA will consider and solicit comments on the following factors: the continued need for the rule; the nature of complaints or comments received concerning the rule; the complexity of the rule; the extent to which the rule overlaps, duplicates, or conflicts with other Federal, State, or local government rules; and the degree to which the technology, economic conditions or other factors have changed in areas affected by the rule.","[{'raw_name': 'ENVIRONMENTAL PROTECTION AGENCY', 'name': 'Environmental Protection Agency', 'id': 145, 'url': 'https://www.federalregister.gov/agencies/environmental-protection-agency', 'json_url': 'https://www.federalregister.gov/api/v1/agencies/145', 'parent_id': None, 'slug': 'environmental-protection-agency'}]",https://www.federalregister.gov/documents/2025/03/31/2025-05385/section-610-review-of-national-emission-standards-for-hazardous-air-pollutants-for-brick-and
US,Federal Register,2025-03-31,"Air Plan Approval; California; State Implementation Plan Revision for Chico, Modesto, and Stockton Carbon Monoxide Maintenance Areas","The Environmental Protection Agency (EPA) is proposing to approve a revision to the California state implementation plan (SIP) that removes carbon monoxide (CO) contingency measures and monitoring requirements from the maintenance plan for three CO maintenance areas: Chico Urbanized Area, Modesto Urbanized Area, and Stockton Urbanized Area. We are proposing to approve the revision under the Clean Air Act (CAA or ""Act""). We are taking comments on this proposal and plan to follow with a final action.","[{'raw_name': 'ENVIRONMENTAL PROTECTION AGENCY', 'name': 'Environmental Protection Agency', 'id': 145, 'url': 'https://www.federalregister.gov/agencies/environmental-protection-agency', 'json_url': 'https://www.federalregister.gov/api/v1/agencies/145', 'parent_id': None, 'slug': 'environmental-protection-agency'}]",https://www.federalregister.gov/documents/2025/03/31/2025-05369/air-plan-approval-california-state-implementation-plan-revision-for-chico-modesto-and-stockton
US,Federal Register,2025-03-28,Air Plan Approval; Florida; Revisions to Stationary Sources-Removal of Clean Air Interstate Rule Provisions,"The Environmental Protection Agency (EPA) is proposing to approve a State Implementation Plan (SIP) revision submitted by the Florida Department of Environmental Protection (FDEP) on August 15, 2023. The revision seeks to remove certain Clean Air Interstate Rule (CAIR)-related definitions, and CAIR-related portions of certain definitions, in the Stationary Sources--General Requirements chapter of the Florida SIP because they have become obsolete. EPA is proposing to approve these changes pursuant to the Clean Air Act (CAA or Act).","[{'raw_name': 'ENVIRONMENTAL PROTECTION AGENCY', 'name': 'Environmental Protection Agency', 'id': 145, 'url': 'https://www.federalregister.gov/agencies/environmental-protection-agency', 'json_url': 'https://www.federalregister.gov/api/v1/agencies/145', 'parent_id': None, 'slug': 'environmental-protection-agency'}]",https://www.federalregister.gov/documents/2025/03/28/2025-05382/air-plan-approval-florida-revisions-to-stationary-sources-removal-of-clean-air-interstate-rule
US,Federal Register,2025-03-26,Air Plan Revisions; California; Antelope Valley Air Quality Management District; New Source Review; Stationary Source Permits,"The Environmental Protection Agency (EPA) is proposing approval of six permitting rules, and limited approval and limited disapproval for one permitting rule, submitted on January 7, 2025, as a revision to the Antelope Valley Air Quality Management District (AVAQMD or ""District"") portion of the California State Implementation Plan (SIP). These revisions concern the District's New Source Review (NSR) permitting program for new and modified sources of air pollution under part D of title I of the Clean Air Act (CAA or ""Act""). The submitted rules address deficiencies identified in a previous limited disapproval action and incorporate other revisions related to NSR requirements. If finalized, this action will update the AVAQMD's current SIP with the revised rules. We are taking comments on this proposal and plan to follow with a final action. Elsewhere in this Federal Register, we are making an interim final determination that will stay or defer the imposition of CAA sanctions associated with our previous limited disapproval action.","[{'raw_name': 'ENVIRONMENTAL PROTECTION AGENCY', 'name': 'Environmental Protection Agency', 'id': 145, 'url': 'https://www.federalregister.gov/agencies/environmental-protection-agency', 'json_url': 'https://www.federalregister.gov/api/v1/agencies/145', 'parent_id': None, 'slug': 'environmental-protection-agency'}]",https://www.federalregister.gov/documents/2025/03/26/2025-05156/air-plan-revisions-california-antelope-valley-air-quality-management-district-new-source-review
US,Federal Register,2025-03-25,Review of New Source Performance Standards for Stationary Combustion Turbines and Stationary Gas Turbines; Reopening of Comment Period,"On December 13, 2024, the U.S. Environmental Protection Agency (EPA) proposed amendments to the new source performance standards (NSPS) for new, modified, and reconstructed stationary combustion turbines and stationary gas turbines. The EPA is reopening the public comment period for this proposed rule to allow additional time for stakeholders to review and comment on the proposal. The initial 90-day public comment period, which ended March 13, 2025, is being reopened for an additional 21 days, from March 25, 2025 to April 15, 2025.","[{'raw_name': 'ENVIRONMENTAL PROTECTION AGENCY', 'name': 'Environmental Protection Agency', 'id': 145, 'url': 'https://www.federalregister.gov/agencies/environmental-protection-agency', 'json_url': 'https://www.federalregister.gov/api/v1/agencies/145', 'parent_id': None, 'slug': 'environmental-protection-agency'}]",https://www.federalregister.gov/documents/2025/03/25/2025-04990/review-of-new-source-performance-standards-for-stationary-combustion-turbines-and-stationary-gas
US,Federal Register,2025-03-24,"Air Plan Approval; AK, Fairbanks North Star Borough; 2006 24-Hour PM2.5 Serious Area and 189(d) Plan","The Environmental Protection Agency (EPA) is reopening the public comment period on the proposed rule entitled ""Air Plan Approval; AK, Fairbanks North Star Borough; 2006 24-hour PM<INF>2.5</INF> Serious Area and 189(d) Plan"" published on January 8, 2025. Commenters requested more time to review the proposal and prepare comments. In response, the EPA is providing an additional 30 days for the public to provide comment on all aspects of the proposed rule. The January 8, 2025, notice of proposed rulemaking also started the EPA's adequacy process for the motor vehicle emissions budgets and began the public comment period for that process. The EPA is not reopening the public comment period for the adequacy process, and it intends to proceed with the adequacy process outside of this rulemaking.","[{'raw_name': 'ENVIRONMENTAL PROTECTION AGENCY', 'name': 'Environmental Protection Agency', 'id': 145, 'url': 'https://www.federalregister.gov/agencies/environmental-protection-agency', 'json_url': 'https://www.federalregister.gov/api/v1/agencies/145', 'parent_id': None, 'slug': 'environmental-protection-agency'}]",https://www.federalregister.gov/documents/2025/03/24/2025-04908/air-plan-approval-ak-fairbanks-north-star-borough-2006-24-hour-pm25-serious-area-and-189d-plan
US,Federal Register,2025-03-24,Air Plan Approval; ID; Regional Haze Plan for the Second Implementation Period,"The Environmental Protection Agency (EPA) is proposing to approve the Idaho regional haze State Implementation Plan (SIP) revision submitted on August 5, 2022, and supplemented on May 8, 2024. Idaho submitted the SIP revision to address the requirement to make reasonable progress toward the national goal of preventing any future, and remedying any existing, anthropogenic impairment of visibility in certain national parks and wilderness areas.","[{'raw_name': 'ENVIRONMENTAL PROTECTION AGENCY', 'name': 'Environmental Protection Agency', 'id': 145, 'url': 'https://www.federalregister.gov/agencies/environmental-protection-agency', 'json_url': 'https://www.federalregister.gov/api/v1/agencies/145', 'parent_id': None, 'slug': 'environmental-protection-agency'}]",https://www.federalregister.gov/documents/2025/03/24/2025-04906/air-plan-approval-id-regional-haze-plan-for-the-second-implementation-period
US,Federal Register,2025-03-24,WOTUS Notice: The Final Response to SCOTUS; Establishment of a Public Docket; Request for Recommendations,"The U.S. Environmental Protection Agency (EPA) and the Department of the Army intend to engage with State and Tribal co- regulators; industry and agricultural stakeholders; environmental and conservation stakeholders; and the public on certain key topics related to the implementation of the definition of ""waters of the United States"" in light of the Supreme Court's 2023 decision in Sackett v. Environmental Protection Agency. The agencies are committed to learning from the past regulatory approaches--the pre-2015 regulations and guidance, the 2015 Clean Water Rule, the 2020 Navigable Waters Protection Rule, the 2023 Rule, and the Amended 2023 Rule--while engaging with stakeholders before taking further administrative action to provide any additional clarification to agency staff, co-regulators, and the public on specific aspects of the definition of ""waters of the United States."" This notice includes an announcement of forthcoming listening sessions on specific key topic areas to hear interested stakeholders' perspectives on defining ""waters of the United States"" consistent with the Supreme Court's interpretation of the scope of Clean Water Act jurisdiction and how to implement that interpretation as the agencies consider next steps. The agencies are also accepting written recommendations from members of the public via a recommendations docket. These opportunities are intended to provide for broad, transparent engagement with a full spectrum of stakeholders.","[{'raw_name': 'DEPARTMENT OF DEFENSE', 'name': 'Defense Department', 'id': 103, 'url': 'https://www.federalregister.gov/agencies/defense-department', 'json_url': 'https://www.federalregister.gov/api/v1/agencies/103', 'parent_id': None, 'slug': 'defense-department'}, {'raw_name': 'Department of the Army, Corps of Engineers', 'name': 'Engineers Corps', 'id': 142, 'url': 'https://www.federalregister.gov/agencies/engineers-corps', 'json_url': 'https://www.federalregister.gov/api/v1/agencies/142', 'parent_id': 103, 'slug': 'engineers-corps'}, {'raw_name': 'ENVIRONMENTAL PROTECTION AGENCY', 'name': 'Environmental Protection Agency', 'id': 145, 'url': 'https://www.federalregister.gov/agencies/environmental-protection-agency', 'json_url': 'https://www.federalregister.gov/api/v1/agencies/145', 'parent_id': None, 'slug': 'environmental-protection-agency'}]",https://www.federalregister.gov/documents/2025/03/24/2025-04649/wotus-notice-the-final-response-to-scotus-establishment-of-a-public-docket-request-for
US,Federal Register,2025-03-21,Determination of Attainment by the Attainment Date; 2008 8-Hour Ozone Standards; California; Sacramento Metro Area,"The Environmental Protection Agency (EPA) is proposing to determine that the Sacramento Metro, California area attained the 2008 8-hour ozone national ambient air quality standards (NAAQS) by its December 31, 2024 attainment date. This proposed determination is based on quality-assured and certified ambient air quality monitoring data from 2022 through 2024. If we finalize this determination as proposed, the requirement for the State to have contingency measures for reasonable further progress (RFP) and attainment for the 2008 ozone NAAQS will no longer apply for this area. We are taking comments on this proposal and plan to follow with a final action. Elsewhere in this Federal Register, we are making an interim final determination that will stay and defer the imposition of Clean Air Act (CAA or ""Act"") sanctions associated with a disapproval action related to the contingency measures requirement for this area.","[{'raw_name': 'ENVIRONMENTAL PROTECTION AGENCY', 'name': 'Environmental Protection Agency', 'id': 145, 'url': 'https://www.federalregister.gov/agencies/environmental-protection-agency', 'json_url': 'https://www.federalregister.gov/api/v1/agencies/145', 'parent_id': None, 'slug': 'environmental-protection-agency'}]",https://www.federalregister.gov/documents/2025/03/21/2025-04791/determination-of-attainment-by-the-attainment-date-2008-8-hour-ozone-standards-california-sacramento
US,Federal Register,2025-03-20,National Emission Standards for Hazardous Air Pollutants: Chemical Manufacturing Area Sources Technology Review; Comment Period Extension,"On January 22, 2025, the U.S. Environmental Protection Agency (EPA) proposed a rule titled ""National Emission Standards for Hazardous Air Pollutants: Chemical Manufacturing Area Sources Technology Review."" The EPA is extending the comment period on this proposed rule, which was scheduled to close on March 24, 2025. The comment period will now remain open until April 14, 2025, to allow additional time for stakeholders to review and comment on the proposal.","[{'raw_name': 'ENVIRONMENTAL PROTECTION AGENCY', 'name': 'Environmental Protection Agency', 'id': 145, 'url': 'https://www.federalregister.gov/agencies/environmental-protection-agency', 'json_url': 'https://www.federalregister.gov/api/v1/agencies/145', 'parent_id': None, 'slug': 'environmental-protection-agency'}]",https://www.federalregister.gov/documents/2025/03/20/2025-04653/national-emission-standards-for-hazardous-air-pollutants-chemical-manufacturing-area-sources
