country,source,date,title,summary,agency,url
US,Federal Register,2025-09-05,Air Plan Approval; Kentucky; Emissions Inventory and Nonattainment New Source Review for the Henderson-Webster Sulfur Dioxide Nonattainment Area,"The Environmental Protection Agency (EPA) is proposing to approve two State Implementation Plan (SIP) revisions submitted by the Commonwealth of Kentucky, through the Energy and Environment Cabinet (Cabinet), Division of Air Quality (DAQ) on January 26, 2024, and February 15, 2024, to certify two requirements under the Clean Air Act (CAA or Act). These revisions establish that the Kentucky SIP satisfies the nonattainment new source review (NNSR) and base year emissions inventory requirements for the 2010 1-hour sulfur dioxide (SO<INF>2</INF>) national ambient air quality standard (NAAQS) for the Henderson-Webster SO<INF>2</INF> nonattainment area (hereinafter ""Henderson-Webster SO<INF>2</INF> Nonattainment Area"" or ""Area""). These actions are being proposed pursuant to the CAA.","[{'raw_name': 'ENVIRONMENTAL PROTECTION AGENCY', 'name': 'Environmental Protection Agency', 'id': 145, 'url': 'https://www.federalregister.gov/agencies/environmental-protection-agency', 'json_url': 'https://www.federalregister.gov/api/v1/agencies/145', 'parent_id': None, 'slug': 'environmental-protection-agency'}]",https://www.federalregister.gov/documents/2025/09/05/2025-17048/air-plan-approval-kentucky-emissions-inventory-and-nonattainment-new-source-review-for-the
US,Federal Register,2025-09-05,Air Plan Approval; Arkansas; Regional Haze State Implementation Plan for the Second Implementation Period,"Pursuant to the Clean Air Act (CAA or the Act), the Environmental Protection Agency (EPA) is proposing to approve a State Implementation Plan (SIP) revision submitted by the State of Arkansas through the Division of Environmental Quality (DEQ) on August 8, 2022, and clarified by DEQ on July 29, 2025, as satisfying the requirements of the Act and the EPA's Regional Haze Rule (RHR) for visibility protection in mandatory Class I Federal areas (Class I areas) for the program's second implementation period. Arkansas' SIP submission addresses the requirement that states must revise their long-term strategies for making reasonable progress to prevent any future and remedy any existing man-made visibility impairment in the Class I areas. The EPA is taking this action pursuant to sections 110 and 169A of the CAA.","[{'raw_name': 'ENVIRONMENTAL PROTECTION AGENCY', 'name': 'Environmental Protection Agency', 'id': 145, 'url': 'https://www.federalregister.gov/agencies/environmental-protection-agency', 'json_url': 'https://www.federalregister.gov/api/v1/agencies/145', 'parent_id': None, 'slug': 'environmental-protection-agency'}]",https://www.federalregister.gov/documents/2025/09/05/2025-17041/air-plan-approval-arkansas-regional-haze-state-implementation-plan-for-the-second-implementation
US,Federal Register,2025-09-05,Revisions to the Clean Air Act Operating Permit Program; California; San Diego County Air Pollution Control District,"The Environmental Protection Agency (EPA) is proposing approval of revisions to the Clean Air Act (CAA or ""Act"") Operating Permit Program (title V) of the San Diego County Air Pollution Control District (SDCAPCD or ""District"") in California. Once approved, these revisions will update the District's public noticing requirements to conform to current federal requirements for title V programs. We are taking comments on these proposed revisions and are simultaneously publishing our final action approving these revisions in a direct final rule.","[{'raw_name': 'ENVIRONMENTAL PROTECTION AGENCY', 'name': 'Environmental Protection Agency', 'id': 145, 'url': 'https://www.federalregister.gov/agencies/environmental-protection-agency', 'json_url': 'https://www.federalregister.gov/api/v1/agencies/145', 'parent_id': None, 'slug': 'environmental-protection-agency'}]",https://www.federalregister.gov/documents/2025/09/05/2025-17038/revisions-to-the-clean-air-act-operating-permit-program-california-san-diego-county-air-pollution
US,Federal Register,2025-09-05,Receipt of Pesticide Petitions Filed for Residues of Pesticide Chemicals in or on Various Commodities-June 2025,"This document announces the Agency's receipt of and solicits public comment on initial filings of pesticide petitions requesting the establishment or modification of regulations for residues of pesticide chemicals in or on various commodities. The Agency is providing this notice in accordance with the Federal Food, Drug, and Cosmetic Act (FFDCA). EPA uses the month and year in the title to identify when the Agency compiled the petitions identified in this notice of filing. Unit II. of this document identifies certain petitions received in 2023, 2024, and 2025 that are currently being evaluated by EPA, along with information about each petition, including who submitted the petition and the requested action.","[{'raw_name': 'ENVIRONMENTAL PROTECTION AGENCY', 'name': 'Environmental Protection Agency', 'id': 145, 'url': 'https://www.federalregister.gov/agencies/environmental-protection-agency', 'json_url': 'https://www.federalregister.gov/api/v1/agencies/145', 'parent_id': None, 'slug': 'environmental-protection-agency'}]",https://www.federalregister.gov/documents/2025/09/05/2025-17008/receipt-of-pesticide-petitions-filed-for-residues-of-pesticide-chemicals-in-or-on-various
US,Federal Register,2025-09-04,Hazardous and Solid Waste Management System: Disposal of Coal Combustion Residuals From Electric Utilities; CCR Management Unit Deadline Extension Rule; Reopening of Comment Period and Public Hearing,"The Environmental Protection Agency (EPA or the Agency) is reopening the comment period for the proposed rule entitled ""Hazardous and Solid Waste Management System: Disposal of Coal Combustion Residuals From Electric Utilities; CCR Management Unit Deadline Extension Rule."" EPA is reopening the comment period until September 15, 2025, in response to stakeholders' requests for a public hearing and comment period extension.","[{'raw_name': 'ENVIRONMENTAL PROTECTION AGENCY', 'name': 'Environmental Protection Agency', 'id': 145, 'url': 'https://www.federalregister.gov/agencies/environmental-protection-agency', 'json_url': 'https://www.federalregister.gov/api/v1/agencies/145', 'parent_id': None, 'slug': 'environmental-protection-agency'}]",https://www.federalregister.gov/documents/2025/09/04/2025-16974/hazardous-and-solid-waste-management-system-disposal-of-coal-combustion-residuals-from-electric
US,Federal Register,2025-09-02,Wyoming: Approval of State Coal Combustion Residuals Permit Program,"The Environmental Protection Agency (EPA or the Agency) is proposing to approve the Wyoming coal combustion residuals (CCR) permit program under the Resource Conservation and Recovery Act (RCRA). After reviewing the CCR permit program application submitted by the Wyoming Department of Environmental Quality (WDEQ), EPA has preliminarily determined that Wyoming's CCR permit program meets the standard for partial approval under RCRA. If approved, Wyoming's CCR permit program will operate in lieu of the Federal CCR program with the exception of the specific provisions noted below. EPA is seeking comment on this proposal during a 60-day public comment period and will hold a hybrid in-person and online public hearing on EPA's preliminary approval of Wyoming's partial CCR permit program.","[{'raw_name': 'ENVIRONMENTAL PROTECTION AGENCY', 'name': 'Environmental Protection Agency', 'id': 145, 'url': 'https://www.federalregister.gov/agencies/environmental-protection-agency', 'json_url': 'https://www.federalregister.gov/api/v1/agencies/145', 'parent_id': None, 'slug': 'environmental-protection-agency'}]",https://www.federalregister.gov/documents/2025/09/02/2025-16801/wyoming-approval-of-state-coal-combustion-residuals-permit-program
US,Federal Register,2025-09-02,Air Plan Approval; GA; Removal of Nonattainment Area New Source Review,"The Environmental Protection Agency (EPA) is proposing to approve a State Implementation Plan (SIP) revision submitted by the State of Georgia through the Georgia Environmental Protection Division (EPD) on June 27, 2024. The revision seeks to remove permitting requirements related to nonattainment, including nonattainment new source review (NNSR), from Georgia's SIP as obsolete, remove certain provisions related to the use of emission reduction credits (ERCs), and make other changes based upon the lack of any areas designated as nonattainment for the National Ambient Air Quality Standards (NAAQS) in Georgia. EPA is proposing to approve these changes pursuant to the Clean Air Act (CAA or Act).","[{'raw_name': 'ENVIRONMENTAL PROTECTION AGENCY', 'name': 'Environmental Protection Agency', 'id': 145, 'url': 'https://www.federalregister.gov/agencies/environmental-protection-agency', 'json_url': 'https://www.federalregister.gov/api/v1/agencies/145', 'parent_id': None, 'slug': 'environmental-protection-agency'}]",https://www.federalregister.gov/documents/2025/09/02/2025-16723/air-plan-approval-ga-removal-of-nonattainment-area-new-source-review
US,Federal Register,2025-08-28,"Approval of the Clean Air Act, Section 112(l), Authority for Hazardous Air Pollutants; State of Connecticut Department of Energy and Environmental Protection; Approval of the Clean Air Act Section 502, State Operating Permit Programs, State of Connecticut Department of Energy and Environmental Protection","The Environmental Protection Agency (EPA) is proposing to approve regulatory amendments that revise two previous program approvals from the Connecticut Department of Energy and Environmental Protection (CT DEEP). The revisions include amendments to the Regulations of Connecticut State Agencies (RCSA) that revise the Connecticut State Operating Permit Program and amendments to RCSA that revise limitations on potential to emit Clean Air Act (CAA) pollutants. A significant aspect of this action involves revising the definition of ""hazardous air pollutant"" in the RCSA in response to EPA adding 1- bromopropane to the list of hazardous air pollutants. This action is being taken under the Clean Air Act.","[{'raw_name': 'ENVIRONMENTAL PROTECTION AGENCY', 'name': 'Environmental Protection Agency', 'id': 145, 'url': 'https://www.federalregister.gov/agencies/environmental-protection-agency', 'json_url': 'https://www.federalregister.gov/api/v1/agencies/145', 'parent_id': None, 'slug': 'environmental-protection-agency'}]",https://www.federalregister.gov/documents/2025/08/28/2025-16486/approval-of-the-clean-air-act-section-112l-authority-for-hazardous-air-pollutants-state-of
US,Federal Register,2025-08-28,Air Plan Approval; Ohio; 2015 Ozone Moderate Reasonably Available Control Technology SIP,"The Environmental Protection Agency (EPA) is proposing to approve revisions to Ohio Administrative Code (OAC) Chapters 3745-21 and 3745-110 into the Ohio State Implementation Plan (SIP). The Ohio Environmental Protection Agency (""Ohio"" or ""Ohio EPA"") submitted these revisions on March 30, 2022, and supplemented the submittal on February 1, 2023, and August 28, 2023. EPA is proposing to approve parts of OAC Chapters 3745-21 and 3745-110 as satisfying some of the Moderate Volatile Organic Compound (VOC) Reasonably Available Control Technology (RACT) and Nitrogen Oxide (NO<INF>x</INF>) RACT requirements for the Cleveland, OH nonattainment area (Cuyahoga, Geauga, Lake, Lorain, Medina, Portage, and Summit counties) under the 2015 ozone National Ambient Air Quality Standard (""NAAQS"" or ""standard""). Finally, EPA is proposing to approve OAC rule 3745-15-03, submitted by Ohio on February 9, 2023, and supplemented on December 1, 2023, and December 30, 2024.","[{'raw_name': 'ENVIRONMENTAL PROTECTION AGENCY', 'name': 'Environmental Protection Agency', 'id': 145, 'url': 'https://www.federalregister.gov/agencies/environmental-protection-agency', 'json_url': 'https://www.federalregister.gov/api/v1/agencies/145', 'parent_id': None, 'slug': 'environmental-protection-agency'}]",https://www.federalregister.gov/documents/2025/08/28/2025-16484/air-plan-approval-ohio-2015-ozone-moderate-reasonably-available-control-technology-sip
US,Federal Register,2025-08-28,Air Plan Approval; Arkansas; Codification of the State Implementation Plan,"Pursuant to the Federal Clean Air Act (CAA or the Act), the Environmental Protection Agency (EPA) is proposing to approve revisions to the Arkansas State Implementation Plan (SIP) submitted to the EPA on February 4, 2025. The revisions address the codification of the Arkansas Pollution Control and Ecology Commission (APC & EC) Rule 19 and Regulations 9, 26, and 31 into the Code of Arkansas Rules (CAR). The revisions are non-substantive and administrative in nature, and do not add or relax any provisions in the approved SIP.","[{'raw_name': 'ENVIRONMENTAL PROTECTION AGENCY', 'name': 'Environmental Protection Agency', 'id': 145, 'url': 'https://www.federalregister.gov/agencies/environmental-protection-agency', 'json_url': 'https://www.federalregister.gov/api/v1/agencies/145', 'parent_id': None, 'slug': 'environmental-protection-agency'}]",https://www.federalregister.gov/documents/2025/08/28/2025-16483/air-plan-approval-arkansas-codification-of-the-state-implementation-plan
US,Federal Register,2025-08-28,Air Plan Approval; Pennsylvania; Motor Vehicle Inspection and Maintenance Program Certification for Moderate Nonattainment Under the 2015 Ozone National Ambient Air Quality Standards,"The Environmental Protection Agency (EPA) is proposing to approve a state implementation plan (SIP) revision submitted by the Commonwealth of Pennsylvania. This SIP revision addresses Clean Air Act (CAA) requirements for the enactment of a Basic vehicle emissions inspection and maintenance (I/M) program for the five counties comprising the Pennsylvania portion of the Philadelphia-Wilmington- Atlantic City, PA-NJ-MD-DE Moderate nonattainment area (Philadelphia nonattainment area) for the 2015 8-hour ozone national ambient air quality standards (NAAQS).","[{'raw_name': 'ENVIRONMENTAL PROTECTION AGENCY', 'name': 'Environmental Protection Agency', 'id': 145, 'url': 'https://www.federalregister.gov/agencies/environmental-protection-agency', 'json_url': 'https://www.federalregister.gov/api/v1/agencies/145', 'parent_id': None, 'slug': 'environmental-protection-agency'}]",https://www.federalregister.gov/documents/2025/08/28/2025-16482/air-plan-approval-pennsylvania-motor-vehicle-inspection-and-maintenance-program-certification-for
US,Federal Register,2025-08-26,Air Plan Revisions; California; Heavy-Duty Vehicle Inspection and Maintenance Program,"The U.S. Environmental Protection Agency (EPA) is proposing to partially approve and partially disapprove or, in the alternative, to fully approve a submission by the State of California to revise its State Implementation Plan (SIP) relating to the control of emissions from non-gasoline combustion vehicles over 14,000 pounds. EPA is proposing to disapprove the State's ""Heavy-Duty Inspection and Maintenance Regulation"" to the extent it applies to vehicles registered out-of-state or out-of-country. The EPA has substantial concerns that the State has not provided adequate assurances under Clean Air Act (CAA) section 110(a)(2)(E)(i) that implementation of the SIP is not prohibited by Federal law. EPA seeks comment on this and other aspects of this proposed rule. If finalized as a partial approval and partial disapproval, this rule would allow certain aspects of the covered State regulations to go into effect and would not trigger CAA section 179 sanctions because the submittal is not a required submission under CAA section 110(a)(2). If finalized as an approval, this rule would allow all covered State regulations to go into effect.","[{'raw_name': 'ENVIRONMENTAL PROTECTION AGENCY', 'name': 'Environmental Protection Agency', 'id': 145, 'url': 'https://www.federalregister.gov/agencies/environmental-protection-agency', 'json_url': 'https://www.federalregister.gov/api/v1/agencies/145', 'parent_id': None, 'slug': 'environmental-protection-agency'}]",https://www.federalregister.gov/documents/2025/08/26/2025-16325/air-plan-revisions-california-heavy-duty-vehicle-inspection-and-maintenance-program
US,Federal Register,2025-08-21,Air Plan Approval; Alabama; Standards for Granting Permits and Major New Source Review Permit Rules,"The Environmental Protection Agency (EPA) is proposing to approve a revision to the Alabama State Implementation Plan (SIP) submitted by the Alabama Department of Environmental Management (ADEM) on December 20, 2023. The proposed SIP revision consists of minor changes to certain air permit regulations that have been revised by the State agency since EPA last approved those provisions. EPA is proposing to approve the SIP revision pursuant to the Clean Air Act (CAA or Act).","[{'raw_name': 'ENVIRONMENTAL PROTECTION AGENCY', 'name': 'Environmental Protection Agency', 'id': 145, 'url': 'https://www.federalregister.gov/agencies/environmental-protection-agency', 'json_url': 'https://www.federalregister.gov/api/v1/agencies/145', 'parent_id': None, 'slug': 'environmental-protection-agency'}]",https://www.federalregister.gov/documents/2025/08/21/2025-15987/air-plan-approval-alabama-standards-for-granting-permits-and-major-new-source-review-permit-rules
US,Federal Register,2025-08-21,Air Plan Approval; GA; Removal of Emissions Statements Requirement and Updates To Permit by Rule,"The Environmental Protection Agency (EPA) is proposing to approve a State Implementation Plan (SIP) revision submitted by the State of Georgia, through the Georgia Environmental Protection Division (GA EPD), on June 27, 2024, seeking to revise a source monitoring and reporting regulation by, among other things, removing the requirement for emissions statements in counties formerly designated as nonattainment for ozone and to revise the permit by rule regulation. EPA is proposing to approve these revisions pursuant to the Clean Air Act (CAA or Act).","[{'raw_name': 'ENVIRONMENTAL PROTECTION AGENCY', 'name': 'Environmental Protection Agency', 'id': 145, 'url': 'https://www.federalregister.gov/agencies/environmental-protection-agency', 'json_url': 'https://www.federalregister.gov/api/v1/agencies/145', 'parent_id': None, 'slug': 'environmental-protection-agency'}]",https://www.federalregister.gov/documents/2025/08/21/2025-15986/air-plan-approval-ga-removal-of-emissions-statements-requirement-and-updates-to-permit-by-rule
US,Federal Register,2025-08-21,Air Plan Approval; Arizona; Maricopa County Air Quality Department; Petroleum Solvent Dry Cleaning,"The Environmental Protection Agency (EPA) is proposing to approve a revision to the Maricopa County Air Quality Department (MCAQD) portion of the Arizona State Implementation Plan (SIP). This revision clarifies definitions used in a rule that limits volatile organic compounds (VOCs) emissions from petroleum solvents used in dry cleaning. We are proposing to approve the rule revisions under the Clean Air Act (CAA or ""Act""). We are taking comments on this proposal and plan to follow with a final action.","[{'raw_name': 'ENVIRONMENTAL PROTECTION AGENCY', 'name': 'Environmental Protection Agency', 'id': 145, 'url': 'https://www.federalregister.gov/agencies/environmental-protection-agency', 'json_url': 'https://www.federalregister.gov/api/v1/agencies/145', 'parent_id': None, 'slug': 'environmental-protection-agency'}]",https://www.federalregister.gov/documents/2025/08/21/2025-15984/air-plan-approval-arizona-maricopa-county-air-quality-department-petroleum-solvent-dry-cleaning
US,Federal Register,2025-08-21,"Air Plan Approval; IA, Muscatine; 2010 1-Hour SO2 Maintenance Plan and Redesignation","The Environmental Protection Agency (EPA) is proposing to redesignate the nonattainment area in Muscatine County, Iowa to attainment for the 2010 1-hour sulfur dioxide (SO<INF>2</INF>) National Ambient Air Quality Standard (NAAQS). The EPA is also proposing to approve Iowa's maintenance plan for the 2010 1-hour SO<INF>2</INF> NAAQS for the Muscatine nonattainment area and approve modifications to source-specific permits in the Iowa State Implementation Plan (SIP). The EPA's proposed approval of this rule revision is being done in accordance with the requirements of the Clean Air Act (CAA).","[{'raw_name': 'ENVIRONMENTAL PROTECTION AGENCY', 'name': 'Environmental Protection Agency', 'id': 145, 'url': 'https://www.federalregister.gov/agencies/environmental-protection-agency', 'json_url': 'https://www.federalregister.gov/api/v1/agencies/145', 'parent_id': None, 'slug': 'environmental-protection-agency'}]",https://www.federalregister.gov/documents/2025/08/21/2025-15983/air-plan-approval-ia-muscatine-2010-1-hour-so2-maintenance-plan-and-redesignation
US,Federal Register,2025-08-19,Air Plan Approval; Tennessee; Second Planning Period Regional Haze Plan,"The Environmental Protection Agency (EPA) is proposing to approve a regional haze State Implementation Plan (SIP) revision submitted by the Tennessee Department of Environmental Conservation (TDEC), dated February 23, 2022, as satisfying the applicable requirements under the Clean Air Act (CAA or Act) and EPA's Regional Haze Rule (RHR) for the program's second planning period. Tennessee's SIP submission addresses the requirement that states must periodically revise their long-term strategies for making reasonable progress toward the national goal of preventing any future, and remedying any existing, anthropogenic impairment of visibility, including regional haze, in mandatory Class I Federal areas. The SIP submission also addresses other applicable requirements for the second planning period of the regional haze program. EPA is proposing this action pursuant to sections 110 and 169A of the Act.","[{'raw_name': 'ENVIRONMENTAL PROTECTION AGENCY', 'name': 'Environmental Protection Agency', 'id': 145, 'url': 'https://www.federalregister.gov/agencies/environmental-protection-agency', 'json_url': 'https://www.federalregister.gov/api/v1/agencies/145', 'parent_id': None, 'slug': 'environmental-protection-agency'}]",https://www.federalregister.gov/documents/2025/08/19/2025-15748/air-plan-approval-tennessee-second-planning-period-regional-haze-plan
US,Federal Register,2025-08-15,Air Plan Approval; North Carolina; Removal of Emissions Exemptions,"The Environmental Protection Agency (EPA) is proposing to approve separate but related State Implementation Plan (SIP) revisions submitted by the North Carolina Division of Air Quality (NCDAQ). First, EPA is proposing to approve a SIP revision submitted by NCDAQ on behalf of the State of North Carolina on October 27, 2023, to remove certain exemptions available at the discretion of a State official for emissions exceeding otherwise applicable SIP emission limitations. Second, EPA is proposing to approve a SIP revision submitted by NCDAQ on behalf of Mecklenburg County Air Quality (MCAQ or Mecklenburg County) on October 25, 2023, to remove a parallel local exemption analogous to the State's for emissions exceeding otherwise applicable SIP emission limitations. In addition, EPA is proposing to approve minor and administrative changes to certain regulatory provisions that have been revised by the State and Mecklenburg County since EPA's last approval of those provisions. EPA is proposing to approve these SIP revisions pursuant to the Clean Air Act (CAA or Act).","[{'raw_name': 'ENVIRONMENTAL PROTECTION AGENCY', 'name': 'Environmental Protection Agency', 'id': 145, 'url': 'https://www.federalregister.gov/agencies/environmental-protection-agency', 'json_url': 'https://www.federalregister.gov/api/v1/agencies/145', 'parent_id': None, 'slug': 'environmental-protection-agency'}]",https://www.federalregister.gov/documents/2025/08/15/2025-15557/air-plan-approval-north-carolina-removal-of-emissions-exemptions
US,Federal Register,2025-08-15,Reconsideration of 2009 Endangerment Finding and Greenhouse Gas Vehicle Standards; Extension of Comment Period,"On August 1, 2025, the Environmental Protection Agency (EPA) published a proposed rule titled ""Reconsideration of 2009 Endangerment Finding and Greenhouse Gas Vehicle Standards."" EPA is extending the comment period for this proposed rule.","[{'raw_name': 'ENVIRONMENTAL PROTECTION AGENCY', 'name': 'Environmental Protection Agency', 'id': 145, 'url': 'https://www.federalregister.gov/agencies/environmental-protection-agency', 'json_url': 'https://www.federalregister.gov/api/v1/agencies/145', 'parent_id': None, 'slug': 'environmental-protection-agency'}]",https://www.federalregister.gov/documents/2025/08/15/2025-15512/reconsideration-of-2009-endangerment-finding-and-greenhouse-gas-vehicle-standards-extension-of
