country,source,date,title,summary,agency,url
US,Federal Register,2025-12-01,Receipt of Pesticide Petitions Filed for Residues of Pesticide Chemicals in or on Various Commodities-September 2025,"This document announces the Agency's receipt of and solicits public comment on initial filings of pesticide petitions requesting the establishment or modification of regulations for residues of pesticide chemicals in or on various commodities. The Agency is providing this notice in accordance with the Federal Food, Drug, and Cosmetic Act (FFDCA). EPA uses the month and year in the title to identify when the Agency compiled the petitions identified in this notice of filing. Unit II. of this document identifies certain petitions received in 2024, that are currently being evaluated by EPA, along with information about each petition, including who submitted the petition and the requested action.","[{'raw_name': 'ENVIRONMENTAL PROTECTION AGENCY', 'name': 'Environmental Protection Agency', 'id': 145, 'url': 'https://www.federalregister.gov/agencies/environmental-protection-agency', 'json_url': 'https://www.federalregister.gov/api/v1/agencies/145', 'parent_id': None, 'slug': 'environmental-protection-agency'}]",https://www.federalregister.gov/documents/2025/12/01/2025-21679/receipt-of-pesticide-petitions-filed-for-residues-of-pesticide-chemicals-in-or-on-various
US,Federal Register,2025-11-28,Hazardous and Solid Waste Management System: Disposal of Coal Combustion Residuals From Electric Utilities; Extension of an Alternative Closure Requirement Deadline,"The Environmental Protection Agency (EPA or the Agency) is proposing to extend, by three years, one compliance deadline applicable to certain coal combustion residuals (CCR) surface impoundments operating pursuant to the alternative closure requirements. Specifically, EPA is extending the deadline for owners and operators to complete closure of their unlined CCR surface impoundments larger than 40 acres from October 17, 2028, to October 17, 2031. This deadline extension will promote electric grid reliability by allowing a subset of coal-fired power producers to continue to operate beyond their currently scheduled retirement date.","[{'raw_name': 'ENVIRONMENTAL PROTECTION AGENCY', 'name': 'Environmental Protection Agency', 'id': 145, 'url': 'https://www.federalregister.gov/agencies/environmental-protection-agency', 'json_url': 'https://www.federalregister.gov/api/v1/agencies/145', 'parent_id': None, 'slug': 'environmental-protection-agency'}]",https://www.federalregister.gov/documents/2025/11/28/2025-21597/hazardous-and-solid-waste-management-system-disposal-of-coal-combustion-residuals-from-electric
US,Federal Register,2025-11-28,Air Plan Approval; Virginia; Repeal of Existing Stationary Source Regulations,"The Environmental Protection Agency (EPA) is proposing to approve a state implementation plan (SIP) revision (Revision B23) submitted by the Commonwealth of Virginia. The revision seeks to remove two existing stationary sources regulations, emission standards for petroleum refinery operations and emissions standards for large appliance coating application systems, from Virginia's SIP as there are no longer any applicable sources in Virginia. This action is being taken under the Clean Air Act (CAA).","[{'raw_name': 'ENVIRONMENTAL PROTECTION AGENCY', 'name': 'Environmental Protection Agency', 'id': 145, 'url': 'https://www.federalregister.gov/agencies/environmental-protection-agency', 'json_url': 'https://www.federalregister.gov/api/v1/agencies/145', 'parent_id': None, 'slug': 'environmental-protection-agency'}]",https://www.federalregister.gov/documents/2025/11/28/2025-21557/air-plan-approval-virginia-repeal-of-existing-stationary-source-regulations
US,Federal Register,2025-11-28,Air Plan Approval; Connecticut; New Source Review Permit Program State Plan Revision,"The Environmental Protection Agency (EPA) is proposing to approve a State Implementation Plan (SIP) revision submitted by the State of Connecticut. This action consists of revisions to Connecticut's New Source Review (NSR) permit program, primarily to clarify applicability for stationary sources in nonattainment areas. This action is being taken under the Clean Air Act (CAA).","[{'raw_name': 'ENVIRONMENTAL PROTECTION AGENCY', 'name': 'Environmental Protection Agency', 'id': 145, 'url': 'https://www.federalregister.gov/agencies/environmental-protection-agency', 'json_url': 'https://www.federalregister.gov/api/v1/agencies/145', 'parent_id': None, 'slug': 'environmental-protection-agency'}]",https://www.federalregister.gov/documents/2025/11/28/2025-21413/air-plan-approval-connecticut-new-source-review-permit-program-state-plan-revision
US,Federal Register,2025-11-28,"Air Plan Approval; Missouri; Reporting Emission Data, Emission Fees, and Process Information","The Environmental Protection Agency (EPA) is proposing approval of revisions to the Missouri State Implementation Plan (SIP), and Operating Permits Program related to Reporting Emission Data, Emission Fees, and Process Information. The revisions set emission fees and a base fee for calendar years 2025-2028 and beyond, add 1- Bromopropane to the category 1 Hazardous Air Pollutant list in table 1, update two publication dates for material that is incorporated by reference and make minor administrative changes to the rule. These revisions do not impact the stringency of the SIP or have an adverse effect on air quality. The EPA's proposed approval of this rule revision is being done in accordance with the requirements of the Clean Air Act (CAA).","[{'raw_name': 'ENVIRONMENTAL PROTECTION AGENCY', 'name': 'Environmental Protection Agency', 'id': 145, 'url': 'https://www.federalregister.gov/agencies/environmental-protection-agency', 'json_url': 'https://www.federalregister.gov/api/v1/agencies/145', 'parent_id': None, 'slug': 'environmental-protection-agency'}]",https://www.federalregister.gov/documents/2025/11/28/2025-21346/air-plan-approval-missouri-reporting-emission-data-emission-fees-and-process-information
US,Federal Register,2025-11-26,Air Plan Approval; Ohio; Emergency Episodes and Ambient Air Quality Standards,"The Environmental Protection Agency (EPA) is proposing to approve amendments to Ohio Administrative Code (OAC) Chapter 3745-25, Emergency Episodes and Ambient Air Quality Standards, into Ohio's State Implementation Plan (SIP). The amendments to the rule include minor style changes, correct typographical errors, and update publication and referenced material titles, effective dates, and addresses.","[{'raw_name': 'ENVIRONMENTAL PROTECTION AGENCY', 'name': 'Environmental Protection Agency', 'id': 145, 'url': 'https://www.federalregister.gov/agencies/environmental-protection-agency', 'json_url': 'https://www.federalregister.gov/api/v1/agencies/145', 'parent_id': None, 'slug': 'environmental-protection-agency'}]",https://www.federalregister.gov/documents/2025/11/26/2025-21321/air-plan-approval-ohio-emergency-episodes-and-ambient-air-quality-standards
US,Federal Register,2025-11-24,Review of National Emission Standards for Hazardous Air Pollutants From Secondary Lead Smelting Technology Review; Reopening of Comment Period,"On October 1, 2025, the U.S. Environmental Protection Agency (EPA) proposed a rule titled ""National Emission Standards for Hazardous Air Pollutants from Secondary Lead Smelting Technology Review."" The EPA is reopening the comment period on this proposed rule, which closed on November 17, 2025. The comment period will now end on December 8, 2025, to allow additional time for stakeholders to review and comment on the proposal.","[{'raw_name': 'ENVIRONMENTAL PROTECTION AGENCY', 'name': 'Environmental Protection Agency', 'id': 145, 'url': 'https://www.federalregister.gov/agencies/environmental-protection-agency', 'json_url': 'https://www.federalregister.gov/api/v1/agencies/145', 'parent_id': None, 'slug': 'environmental-protection-agency'}]",https://www.federalregister.gov/documents/2025/11/24/2025-20753/review-of-national-emission-standards-for-hazardous-air-pollutants-from-secondary-lead-smelting
US,Federal Register,2025-11-21,Air Plan Approval; Indiana; Second Maintenance Plan for 2008 Ozone NAAQS,"The Environmental Protection Agency (EPA) is proposing to approve a revision to the Indiana State Implementation Plan (SIP). On April 1, 2025, the Indiana Department of Environmental Management (IDEM) submitted a revision to the State's plan for maintaining the 2008 ozone National Ambient Air Quality Standard (NAAQS or standard) in the Indiana portion of the Cincinnati, Ohio-Kentucky-Indiana area. EPA is proposing to approve this maintenance plan because it provides for the maintenance of the 2008 ozone NAAQS for the area for 10 additional years as required by the Clean Air Act (CAA). EPA is also initiating the adequacy review process for motor vehicle emission budgets (Budgets) for the area. This action, if finalized, would make certain commitments related to maintenance of the 2008 ozone NAAQS in this area federally enforceable as part of the Indiana SIP.","[{'raw_name': 'ENVIRONMENTAL PROTECTION AGENCY', 'name': 'Environmental Protection Agency', 'id': 145, 'url': 'https://www.federalregister.gov/agencies/environmental-protection-agency', 'json_url': 'https://www.federalregister.gov/api/v1/agencies/145', 'parent_id': None, 'slug': 'environmental-protection-agency'}]",https://www.federalregister.gov/documents/2025/11/21/2025-20672/air-plan-approval-indiana-second-maintenance-plan-for-2008-ozone-naaqs
US,Federal Register,2025-11-20,Air Plan Approval; New York; Athens Generating Plant,"The Environmental Protection Agency (EPA) is proposing to approve a revision to the State of New York's State Implementation Plan (SIP) for the ozone National Ambient Air Quality Standard (NAAQS) related to a Source-specific SIP (SSSIP) revision for the Athens Generating Plant, located at 9300 US Route 9 West, Athens, NY 12015 (""Athens"" or ""the Facility""). The EPA is proposing to find that the control options in this SSSIP revision implement Reasonably Available Control Technology (RACT) with respect to Oxides of Nitrogen (NO<INF>X</INF>) emissions from the relevant Facility sources, which are identified as three combined-cycle Westinghouse model 501G combustion turbines with associated heat recovery steam generators and steam turbines (identified as Emission Units U-00001, U-00002, and U- 00003 in the Facility's Title V permit and New York's submission). This SSSIP revision is intended to implement NOx RACT for the relevant Facility sources in accordance with the requirements for implementation of the 2008 and 2015 ozone NAAQS. The EPA proposes to determine that this action will not interfere with ozone NAAQS requirements and that it meets all applicable requirements of the Clean Air Act (CAA).","[{'raw_name': 'ENVIRONMENTAL PROTECTION AGENCY', 'name': 'Environmental Protection Agency', 'id': 145, 'url': 'https://www.federalregister.gov/agencies/environmental-protection-agency', 'json_url': 'https://www.federalregister.gov/api/v1/agencies/145', 'parent_id': None, 'slug': 'environmental-protection-agency'}]",https://www.federalregister.gov/documents/2025/11/20/2025-20499/air-plan-approval-new-york-athens-generating-plant
US,Federal Register,2025-11-20,Air Plan Approval; Maine; Chapter 140: Part 70 Air Emission License Regulation,"The Environmental Protection Agency (EPA) is proposing to approve a Clean Air Act (CAA) operating permit program revision submitted by the State of Maine. The revisions include minor changes to Maine's operating permit program that are considered clarifications, that correct grammar, that codify longstanding practices, or that are necessary to utilize an expected future electronic application system. The revisions also include provisions allowing the public comment period on a draft permit to run concurrently with EPA's review of a proposed permit. The intended effect of EPA's action is to propose approval of Maine's revisions. This action is being taken under the CAA.","[{'raw_name': 'ENVIRONMENTAL PROTECTION AGENCY', 'name': 'Environmental Protection Agency', 'id': 145, 'url': 'https://www.federalregister.gov/agencies/environmental-protection-agency', 'json_url': 'https://www.federalregister.gov/api/v1/agencies/145', 'parent_id': None, 'slug': 'environmental-protection-agency'}]",https://www.federalregister.gov/documents/2025/11/20/2025-20498/air-plan-approval-maine-chapter-140-part-70-air-emission-license-regulation
US,Federal Register,2025-11-20,Finding of Failure To Attain and Reclassification of Tribal Portions of the Greater Connecticut Ozone Nonattainment Area as Serious for the 2015 Ozone National Ambient Air Quality Standards,"The Environmental Protection Agency (EPA) previously granted the State of Connecticut's request to reclassify the Greater Connecticut ozone nonattainment area from Moderate to Serious under the 2015 ozone National Ambient Air Quality Standards (NAAQS). That request, however, did not include areas governed by the Mashantucket Pequot Tribal Nation and the Mohegan Indian Tribe that are located within this nonattainment area. Given that ozone monitoring data indicate that the Greater Connecticut area failed to attain the 2015 ozone NAAQS by the applicable attainment date, we are proposing to find that these tribal portions of the area did not attain the standards by the attainment date and to reclassify those portions of the area by operation of law to Serious nonattainment for the 2015 ozone NAAQS. This action, if finalized as proposed, would fulfill the EPA's statutory obligation to determine whether the Mashantucket Pequot Tribal Nation and the Mohegan Indian Tribe portions of the Greater Connecticut area attained the NAAQS by the attainment date. This action also solicits public comment on EPA's prior action on CT DEEP's request to exclude event-influenced air quality monitoring data from regulatory decisions. EPA is required to provide an opportunity for public comment on the claimed exceptional events and all supporting data. This proposed action provides the public with an opportunity to comment on the claimed exceptional events, all supporting documents, and the EPA's July 22, 2024 concurrence and nonconcurrence with CT DEEP's request.","[{'raw_name': 'ENVIRONMENTAL PROTECTION AGENCY', 'name': 'Environmental Protection Agency', 'id': 145, 'url': 'https://www.federalregister.gov/agencies/environmental-protection-agency', 'json_url': 'https://www.federalregister.gov/api/v1/agencies/145', 'parent_id': None, 'slug': 'environmental-protection-agency'}]",https://www.federalregister.gov/documents/2025/11/20/2025-20497/finding-of-failure-to-attain-and-reclassification-of-tribal-portions-of-the-greater-connecticut
US,Federal Register,2025-11-20,Operating Permit Program Approval; New Hampshire; Revised Definitions,"The Environmental Protection Agency (EPA) is proposing to approve revisions to the State of New Hampshire's Clean Air Act (CAA) title V operating permit program. These revisions amend the definitions of ""hazardous air pollutant"" and ""regulated air pollutant"" in New Hampshire regulations to remain consistent with Federal permitting and air toxics requirements in accordance with the CAA.","[{'raw_name': 'ENVIRONMENTAL PROTECTION AGENCY', 'name': 'Environmental Protection Agency', 'id': 145, 'url': 'https://www.federalregister.gov/agencies/environmental-protection-agency', 'json_url': 'https://www.federalregister.gov/api/v1/agencies/145', 'parent_id': None, 'slug': 'environmental-protection-agency'}]",https://www.federalregister.gov/documents/2025/11/20/2025-20496/operating-permit-program-approval-new-hampshire-revised-definitions
US,Federal Register,2025-11-20,Air Plan Approval; Michigan; Infrastructure SIP Requirements for the 2015 Ozone NAAQS; Michigan State Board Requirements,The Environmental Protection Agency (EPA) is approving an element of a State Implementation Plan (SIP) submission from Michigan regarding the infrastructure requirements of section 110 of the Clean Air Act (CAA) for the 2015 ozone National Ambient Air Quality Standards (NAAQS). The infrastructure requirements ensure that the structural components of each State's air quality management program are adequate to meet CAA requirements. This action pertains to CAA section 110(a)(2)(E)(ii).,"[{'raw_name': 'ENVIRONMENTAL PROTECTION AGENCY', 'name': 'Environmental Protection Agency', 'id': 145, 'url': 'https://www.federalregister.gov/agencies/environmental-protection-agency', 'json_url': 'https://www.federalregister.gov/api/v1/agencies/145', 'parent_id': None, 'slug': 'environmental-protection-agency'}]",https://www.federalregister.gov/documents/2025/11/20/2025-20494/air-plan-approval-michigan-infrastructure-sip-requirements-for-the-2015-ozone-naaqs-michigan-state
US,Federal Register,2025-11-20,Air Plan Approval; Connecticut; Ozone Ambient Air Quality Standard and Adhesive and Sealants Regulation Revisions,"The Environmental Protection Agency (EPA) is proposing to approve a State Implementation Plan (SIP) revision submitted by the State of Connecticut. This revision updates state regulations containing ambient air quality standards (AAQS) for ozone to be consistent with EPA's national ambient air quality standards (NAAQS). In addition, this update clarifies the volatile organic compound (VOC) calculation methods for adhesive and sealant products. The intended effect of this action is to propose approval of these regulations into the Connecticut SIP. This action is being taken under the Clean Air Act.","[{'raw_name': 'ENVIRONMENTAL PROTECTION AGENCY', 'name': 'Environmental Protection Agency', 'id': 145, 'url': 'https://www.federalregister.gov/agencies/environmental-protection-agency', 'json_url': 'https://www.federalregister.gov/api/v1/agencies/145', 'parent_id': None, 'slug': 'environmental-protection-agency'}]",https://www.federalregister.gov/documents/2025/11/20/2025-20463/air-plan-approval-connecticut-ozone-ambient-air-quality-standard-and-adhesive-and-sealants
US,Federal Register,2025-11-20,Air Plan Approval; Rhode Island; Regional Haze State Implementation Plan for the Second Implementation Period; Prong 4 (Visibility) for the 2015 8-Hour Ozone National Ambient Air Quality Standard,"The Environmental Protection Agency (EPA) is proposing to approve the regional haze state implementation plan (SIP) revision submitted by Rhode Island on March 7, 2025, as satisfying applicable requirements under the Clean Air Act (CAA) and EPA's Regional Haze Rule (RHR) for the program's second implementation period. Rhode Island's SIP submission addresses the requirement that states must periodically revise their long-term strategies for making reasonable progress towards the national goal of preventing any future, and remedying any existing, anthropogenic impairment of visibility, including regional haze, in mandatory Class I Federal areas. The SIP submission also addresses other applicable requirements for the second implementation period of the regional haze program. EPA is also proposing to approve the remaining element of Rhode Island's September 23, 2020, infrastructure SIP submittal for the 2015 ozone National Ambient Air Quality Standards (NAAQS). The proposed approval of Rhode Island's second implementation period regional haze plan addresses infrastructure SIP requirements related to visibility protection. The EPA is taking this action pursuant to sections 110 and 169A of the Clean Air Act.","[{'raw_name': 'ENVIRONMENTAL PROTECTION AGENCY', 'name': 'Environmental Protection Agency', 'id': 145, 'url': 'https://www.federalregister.gov/agencies/environmental-protection-agency', 'json_url': 'https://www.federalregister.gov/api/v1/agencies/145', 'parent_id': None, 'slug': 'environmental-protection-agency'}]",https://www.federalregister.gov/documents/2025/11/20/2025-20444/air-plan-approval-rhode-island-regional-haze-state-implementation-plan-for-the-second-implementation
US,Federal Register,2025-11-20,Air Plan Approval; Minnesota; Metropolitan Council Wastewater Treatment Plant Title I PM10 SIP Revisions,"The Environmental Protection Agency (EPA) is proposing to approve a request from the Minnesota Pollution Control Agency (MPCA) to revise its State Implementation Plan (SIP) by updating information for the Metropolitan Council Environmental Service (MCES) Metropolitan Council Wastewater Treatment Plant (Metro Plant) in Ramsey County, Minnesota. This SIP revision is being proposed in conjunction with an amendment to a part 70 permit maintaining federally enforceable title I SIP conditions. This SIP revision would result in a reduction of allowable emissions of particulate matter less than 10 microns (PM<INF>10</INF>) emitted by the facility.","[{'raw_name': 'ENVIRONMENTAL PROTECTION AGENCY', 'name': 'Environmental Protection Agency', 'id': 145, 'url': 'https://www.federalregister.gov/agencies/environmental-protection-agency', 'json_url': 'https://www.federalregister.gov/api/v1/agencies/145', 'parent_id': None, 'slug': 'environmental-protection-agency'}]",https://www.federalregister.gov/documents/2025/11/20/2025-20441/air-plan-approval-minnesota-metropolitan-council-wastewater-treatment-plant-title-i-pm10-sip
US,Federal Register,2025-11-20,Approval and Promulgation of State Air Quality Plans (Negative Declarations) for Designated Facilities and Pollutants; District of Columbia,"The Environmental Protection Agency (EPA) is proposing to approve the negative declarations submitted by the District of Columbia Department of Energy and Environment (DCDOEE) on July 19, 2024 and August 28, 2024. The negative declarations submitted by the DCDOEE certify that there are no existing large municipal waste combustors (LMWC), crude oil and natural gas facilities, or electric utility generating units subject to sections 111(d) and 129 of the Clean Air Act (CAA) within the jurisdiction of the District of Columbia.","[{'raw_name': 'ENVIRONMENTAL PROTECTION AGENCY', 'name': 'Environmental Protection Agency', 'id': 145, 'url': 'https://www.federalregister.gov/agencies/environmental-protection-agency', 'json_url': 'https://www.federalregister.gov/api/v1/agencies/145', 'parent_id': None, 'slug': 'environmental-protection-agency'}]",https://www.federalregister.gov/documents/2025/11/20/2025-20419/approval-and-promulgation-of-state-air-quality-plans-negative-declarations-for-designated-facilities
US,Federal Register,2025-11-20,Air Plan Approval; Delaware; 2006 24-Hour Fine Particulate Matter Limited Maintenance Plan for the Philadelphia Nonattainment Area,"The Environmental Protection Agency (EPA) is proposing to approve a limited maintenance plan (LMP) submitted by the Delaware Department of Natural Resources and Environmental Control (DNREC). This LMP is a revision to Delaware's state implementation plan (SIP) and addresses the New Castle County portion of the Philadelphia-Wilmington, PA-NJ-DE area (Philadelphia Area). The EPA is proposing to approve the New Castle County portion of the Philadelphia Area LMP because it provides for the maintenance of the 2006 24-hour fine particulate matter (PM<INF>2.5</INF>) national ambient air quality standard (NAAQS) through the end of the second 10-year maintenance period. In addition, the EPA is initiating the process to find the LMP adequate for transportation conformity purposes. This action is being taken under the Clean Air Act (CAA).","[{'raw_name': 'ENVIRONMENTAL PROTECTION AGENCY', 'name': 'Environmental Protection Agency', 'id': 145, 'url': 'https://www.federalregister.gov/agencies/environmental-protection-agency', 'json_url': 'https://www.federalregister.gov/api/v1/agencies/145', 'parent_id': None, 'slug': 'environmental-protection-agency'}]",https://www.federalregister.gov/documents/2025/11/20/2025-20418/air-plan-approval-delaware-2006-24-hour-fine-particulate-matter-limited-maintenance-plan-for-the
US,Federal Register,2025-11-20,Air Plan Approval; District of Columbia; Creation of Synthetic Minor Permit Program,"The Environmental Protection Agency (EPA) is proposing to approve a state implementation plan (SIP) revision submitted by the Department of Energy and Environment (DOEE, the ""Department"") on behalf of the District of Columbia (DC, the ""District""). The revisions pertain to creating a synthetic minor permit program and resolving the regulatory differences between the District's current regulations and those regulations approved previously in Chapters 1 and 2 of the Air Quality Regulations. The intended effect of this action is to enable DC to create federally enforceable synthetic minor permit conditions for sources of criteria pollutants pursuant to section 110 of the Clean Air Act (CAA, the ""Act""). This action is being taken under the CAA.","[{'raw_name': 'ENVIRONMENTAL PROTECTION AGENCY', 'name': 'Environmental Protection Agency', 'id': 145, 'url': 'https://www.federalregister.gov/agencies/environmental-protection-agency', 'json_url': 'https://www.federalregister.gov/api/v1/agencies/145', 'parent_id': None, 'slug': 'environmental-protection-agency'}]",https://www.federalregister.gov/documents/2025/11/20/2025-20416/air-plan-approval-district-of-columbia-creation-of-synthetic-minor-permit-program
