country,source,date,title,summary,agency,url
US,Federal Register,2025-07-09,Significant New Use Rules on Certain Chemical Substances (23-2.5e); Withdrawal,"In the Federal Register of June 20, 2023, EPA proposed significant new use rules (SNURs) under the Toxic Substances Control Act (TSCA) for 18 chemical substances that were the subject of premanufacture notices (PMNs) and a subsequent TSCA Order. EPA is withdrawing the proposed rules because the Agency withdrew the TSCA Order that was the basis of the rules on December 18, 2024.","[{'raw_name': 'ENVIRONMENTAL PROTECTION AGENCY', 'name': 'Environmental Protection Agency', 'id': 145, 'url': 'https://www.federalregister.gov/agencies/environmental-protection-agency', 'json_url': 'https://www.federalregister.gov/api/v1/agencies/145', 'parent_id': None, 'slug': 'environmental-protection-agency'}]",https://www.federalregister.gov/documents/2025/07/09/2025-12704/significant-new-use-rules-on-certain-chemical-substances-23-25e-withdrawal
US,Federal Register,2025-07-07,Establishment of Public Docket and Listening Sessions on Implementation Challenges Associated With Clean Water Act Section 401,The U.S. Environmental Protection Agency (EPA) will initiate a series of stakeholder listening sessions and invite written feedback on regulatory uncertainty or implementation challenges associated with the Clean Water Act (CWA) section 401 certification process as defined in the 2023 Water Quality Certification Improvement Rule. The Agency will use this input to determine whether guidance or rulemaking are necessary to address identified areas of regulatory uncertainty or implementation challenges regarding the scope of certification. The Agency also seeks stakeholder input related to CWA section 401(a)(2) implementation.,"[{'raw_name': 'ENVIRONMENTAL PROTECTION AGENCY', 'name': 'Environmental Protection Agency', 'id': 145, 'url': 'https://www.federalregister.gov/agencies/environmental-protection-agency', 'json_url': 'https://www.federalregister.gov/api/v1/agencies/145', 'parent_id': None, 'slug': 'environmental-protection-agency'}]",https://www.federalregister.gov/documents/2025/07/07/2025-12564/establishment-of-public-docket-and-listening-sessions-on-implementation-challenges-associated-with
US,Federal Register,2025-07-07,New Source Performance Standards; Delegation of Authority to Oklahoma,"The Environmental Protection Agency (EPA) is proposing to update federal regulations to reflect Oklahoma's current New Source Performance Standards (NSPS) delegation status and the mailing address for the Oklahoma Department of Environmental Quality (ODEQ). The ODEQ has submitted updated regulations for the delegation of EPA authority for implementation and enforcement of certain NSPS. The updated State regulations incorporate by reference certain NSPS promulgated by EPA, as they existed through June 30, 2023. The delegation of authority for implementation and enforcement applies to sources subject to the delegated NSPS, including those located in certain areas of Indian country as discussed herein.","[{'raw_name': 'ENVIRONMENTAL PROTECTION AGENCY', 'name': 'Environmental Protection Agency', 'id': 145, 'url': 'https://www.federalregister.gov/agencies/environmental-protection-agency', 'json_url': 'https://www.federalregister.gov/api/v1/agencies/145', 'parent_id': None, 'slug': 'environmental-protection-agency'}]",https://www.federalregister.gov/documents/2025/07/07/2025-12520/new-source-performance-standards-delegation-of-authority-to-oklahoma
US,Federal Register,2025-07-07,Air Plan Approval; Connecticut; 2014 and 2017 Periodic Emissions Inventory for 2008 8-Hour Ozone NAAQS,The Environmental Protection Agency (EPA) is proposing to approve State Implementation Plan (SIP) revisions submitted by the State of Connecticut. These SIP revisions relate to the 2008 8-Hour ozone National Ambient Air Quality Standards (NAAQS). The SIP revisions consist of the following: 2014 and 2017 calendar year periodic emissions inventories. This action is being taken under the Clean Air Act.,"[{'raw_name': 'ENVIRONMENTAL PROTECTION AGENCY', 'name': 'Environmental Protection Agency', 'id': 145, 'url': 'https://www.federalregister.gov/agencies/environmental-protection-agency', 'json_url': 'https://www.federalregister.gov/api/v1/agencies/145', 'parent_id': None, 'slug': 'environmental-protection-agency'}]",https://www.federalregister.gov/documents/2025/07/07/2025-12515/air-plan-approval-connecticut-2014-and-2017-periodic-emissions-inventory-for-2008-8-hour-ozone-naaqs
US,Federal Register,2025-07-07,Air Plan Approval; Oklahoma; Revisions to Air Pollution Control Rules,"Pursuant to the Clean Air Act (CAA or the Act), the Environmental Protection Agency (EPA) is proposing to approve revisions to the State Implementation Plan (SIP) for Oklahoma submitted by the State of Oklahoma on November 25, 2024. The submittal addresses updates to the Oklahoma SIP, specifically, Oklahoma Administrative Code (OAC) Title 252 Chapter 100 Subchapter 13, Open Burning.","[{'raw_name': 'ENVIRONMENTAL PROTECTION AGENCY', 'name': 'Environmental Protection Agency', 'id': 145, 'url': 'https://www.federalregister.gov/agencies/environmental-protection-agency', 'json_url': 'https://www.federalregister.gov/api/v1/agencies/145', 'parent_id': None, 'slug': 'environmental-protection-agency'}]",https://www.federalregister.gov/documents/2025/07/07/2025-12508/air-plan-approval-oklahoma-revisions-to-air-pollution-control-rules
US,Federal Register,2025-07-03,Receipt of Pesticide Petitions Filed for Residues of Pesticide Chemicals in or on Various Commodities (February-May 2025),"This document announces the Agency's receipt of and solicits public comment on initial filings of pesticide petitions requesting the establishment or modification of regulations for residues of pesticide chemicals in or on various commodities. The Agency is providing this notice in accordance with the Federal Food, Drug, and Cosmetic Act (FFDCA). EPA uses the month and year in the title to identify when the Agency compiled the petitions identified in this notice of filing. Unit II. of this document identifies certain petitions received in 2023, 2024 and 2025 that are currently being evaluated by EPA, along with information about each petition, including who submitted the petition and the requested action.","[{'raw_name': 'ENVIRONMENTAL PROTECTION AGENCY', 'name': 'Environmental Protection Agency', 'id': 145, 'url': 'https://www.federalregister.gov/agencies/environmental-protection-agency', 'json_url': 'https://www.federalregister.gov/api/v1/agencies/145', 'parent_id': None, 'slug': 'environmental-protection-agency'}]",https://www.federalregister.gov/documents/2025/07/03/2025-12404/receipt-of-pesticide-petitions-filed-for-residues-of-pesticide-chemicals-in-or-on-various
US,Federal Register,2025-06-27,Air Plan Approval; Missouri; Control of Sulfur Dioxide Emissions and Approval and Promulgation of State Plan (Negative Declaration) for Designated Facilities and Pollutants,"The EPA is proposing to approve revisions to the Missouri State Implementation Plan (SIP) submitted by the State of Missouri. Missouri requests that EPA approve replacing the previous statewide sulfur dioxide (SO<INF>2</INF>) rule in the SIP with the latest version of a newer SO<INF>2</INF> rule (10 CSR 10-6.261). This action would result in a number of changes to the SIP, including removing outdated requirements as a result of facilities that have historically closed or switched from coal to lower sulfur fuels, as well as those that have become subject to more stringent SO<INF>2</INF> requirements elsewhere in the Missouri SIP. Other revisions include reinstating SO<INF>2</INF> emission limits for the Ameren-Labadie and Evergy-Hawthorn power plants that had been previously removed. The revisions do not impact the stringency of the SIP, nor do they impact the state's ability to attain or maintain the National Ambient Air Quality Standards (NAAQS). In conjunction with proposing approval of revisions to the Missouri SIP, the EPA is proposing to approve Missouri's negative declaration of sources subject to sulfuric acid production requirements submitted by the MoDNR to the EPA on May 4, 2022.","[{'raw_name': 'ENVIRONMENTAL PROTECTION AGENCY', 'name': 'Environmental Protection Agency', 'id': 145, 'url': 'https://www.federalregister.gov/agencies/environmental-protection-agency', 'json_url': 'https://www.federalregister.gov/api/v1/agencies/145', 'parent_id': None, 'slug': 'environmental-protection-agency'}]",https://www.federalregister.gov/documents/2025/06/27/2025-11825/air-plan-approval-missouri-control-of-sulfur-dioxide-emissions-and-approval-and-promulgation-of
US,Federal Register,2025-06-27,Air Plan Approval; Missouri; Definitions and Common Reference Tables,"The Environmental Protection Agency (EPA) is proposing to approve revisions to the Missouri State Implementation Plan (SIP) related to Definitions and Common Reference Tables used in Missouri rules. EPA has also previously approved this rule as part of the air planning and permitting program. Some of the definitions are associated with those programs, even though many of the definitions pertain only to the SIP. These revisions do not impact the stringency of the SIP or have an adverse effect on air quality. The EPA's proposed approval of this rule revision is being done in accordance with the requirements of the Clean Air Act (CAA).","[{'raw_name': 'ENVIRONMENTAL PROTECTION AGENCY', 'name': 'Environmental Protection Agency', 'id': 145, 'url': 'https://www.federalregister.gov/agencies/environmental-protection-agency', 'json_url': 'https://www.federalregister.gov/api/v1/agencies/145', 'parent_id': None, 'slug': 'environmental-protection-agency'}]",https://www.federalregister.gov/documents/2025/06/27/2025-11821/air-plan-approval-missouri-definitions-and-common-reference-tables
US,Federal Register,2025-06-23,Air Plan Approval; California; San Joaquin Valley 1-Hour Ozone Area; Maintenance Plan and Redesignation Request,"The Environmental Protection Agency (EPA) is proposing to approve the ""2023 Maintenance Plan and Redesignation Request for the Revoked 1-Hour Ozone Standard"" (""San Joaquin Valley Maintenance Plan"" or ""Plan"") as a revision to the state implementation plan (SIP) for the State of California. The San Joaquin Valley Maintenance Plan includes, among other elements, an emissions inventory consistent with attainment and contingency provisions. The EPA is also proposing to find that the State of California's request to redesignate the San Joaquin Valley area from nonattainment to attainment for the revoked 1979 1-hour national ambient air quality standard (NAAQS or ""standard"") for ozone (""1979 ozone NAAQS,"" ""1-hour ozone NAAQS,"" or ""1-hour ozone standard"") meets all the Clean Air Act (CAA or ""the Act"") criteria for redesignation. Therefore, the EPA is proposing to terminate all anti-backsliding obligations for the San Joaquin Valley area for the revoked 1-hour ozone NAAQS.","[{'raw_name': 'ENVIRONMENTAL PROTECTION AGENCY', 'name': 'Environmental Protection Agency', 'id': 145, 'url': 'https://www.federalregister.gov/agencies/environmental-protection-agency', 'json_url': 'https://www.federalregister.gov/api/v1/agencies/145', 'parent_id': None, 'slug': 'environmental-protection-agency'}]",https://www.federalregister.gov/documents/2025/06/23/2025-11413/air-plan-approval-california-san-joaquin-valley-1-hour-ozone-area-maintenance-plan-and-redesignation
US,Federal Register,2025-06-23,New Source Performance Standards and National Emission Standards for Hazardous Air Pollutants; Delegation of Authority to Louisiana,"The Louisiana Department of Environmental Quality (LDEQ) has submitted updated regulations for receiving delegation and approval of its program for the implementation and enforcement of certain New Source Performance Standards (NSPS) and National Emission Standards for Hazardous Air Pollutants (NESHAP) for all sources, as provided for under previously approved delegation mechanisms. The updated State regulations incorporate by reference certain NSPS and NESHAP promulgated by the Environmental Protection Agency (EPA), as they existed through July 1, 2021. EPA is providing notice that it is updating the delegation of certain NSPS to LDEQ and proposing to approve the delegation of certain NESHAP to LDEQ. The proposed delegation of authority under this action does not apply to sources located in Indian country.","[{'raw_name': 'ENVIRONMENTAL PROTECTION AGENCY', 'name': 'Environmental Protection Agency', 'id': 145, 'url': 'https://www.federalregister.gov/agencies/environmental-protection-agency', 'json_url': 'https://www.federalregister.gov/api/v1/agencies/145', 'parent_id': None, 'slug': 'environmental-protection-agency'}]",https://www.federalregister.gov/documents/2025/06/23/2025-11341/new-source-performance-standards-and-national-emission-standards-for-hazardous-air-pollutants
US,Federal Register,2025-06-20,Air Plan Approval; Guam; Clean Data Determination for the Piti-Cabras Nonattainment Area for the 2010 1-Hour Sulfur Dioxide National Ambient Air Quality Standard,"The Environmental Protection Agency (EPA) is proposing a clean data determination (CDD) for the Piti-Cabras, Guam sulfur dioxide (SO<INF>2</INF>) nonattainment area (""Piti-Cabras area"") based on our determination that the area has attained the 2010 1-hour SO<INF>2</INF> National Ambient Air Quality Standard (NAAQS, ""standard,"" or ""2010 SO<INF>2</INF> NAAQS""). In designated nonattainment areas where air quality data demonstrate that a NAAQS has been attained, the EPA interprets certain requirements of the Clean Air Act (CAA) as no longer applicable for so long as air quality continues to meet the standard. Under this Clean Data Policy, the EPA may issue a determination of attainment, known as a CDD, that a nonattainment area is attaining the relevant NAAQS. If finalized, this proposed CDD would suspend the obligation to submit certain attainment planning requirements for the Piti-Cabras area for as long as the area continues to attain the 2010 SO<INF>2</INF> NAAQS or until the area is formally redesignated.","[{'raw_name': 'ENVIRONMENTAL PROTECTION AGENCY', 'name': 'Environmental Protection Agency', 'id': 145, 'url': 'https://www.federalregister.gov/agencies/environmental-protection-agency', 'json_url': 'https://www.federalregister.gov/api/v1/agencies/145', 'parent_id': None, 'slug': 'environmental-protection-agency'}]",https://www.federalregister.gov/documents/2025/06/20/2025-11326/air-plan-approval-guam-clean-data-determination-for-the-piti-cabras-nonattainment-area-for-the-2010
US,Federal Register,2025-06-20,Finding of Failure To Attain for the Missouri Portion of the St. Louis Nonattainment Area for the 2015 Ozone National Ambient Air Quality Standards,"The Environmental Protection Agency (EPA) is accepting comment on a determination that the Missouri portion of the St. Louis, MO-IL bi-state nonattainment area failed to attain the 2015 8-hour ozone National Ambient Air Quality Standards (NAAQS) by the applicable attainment date. The effect of failing to attain by the applicable attainment date is that the area is reclassified by operation of law to ""Serious"" nonattainment for the 2015 ozone NAAQS. On November 25, 2024, the EPA published a final action in the Federal Register which determined that the St. Louis area failed to attain the 2015 ozone NAAQS by the Moderate area attainment date. That action also reclassified the area to Serious by operation of law with an effective date of December 31, 2024. On January 24, 2025, the EPA received a petition for reconsideration of that final action from the State of Missouri. On March 5, 2025, EPA Region 7 granted the petition for reconsideration and stated our intention to undergo a notice and comment rulemaking. Therefore, the EPA is accepting comment on the determination that the St. Louis area failed to attain by the attainment date. The Illinois portion of the St. Louis, MO-IL bi-state area is addressed separately.","[{'raw_name': 'ENVIRONMENTAL PROTECTION AGENCY', 'name': 'Environmental Protection Agency', 'id': 145, 'url': 'https://www.federalregister.gov/agencies/environmental-protection-agency', 'json_url': 'https://www.federalregister.gov/api/v1/agencies/145', 'parent_id': None, 'slug': 'environmental-protection-agency'}]",https://www.federalregister.gov/documents/2025/06/20/2025-11304/finding-of-failure-to-attain-for-the-missouri-portion-of-the-st-louis-nonattainment-area-for-the
US,Federal Register,2025-06-20,Air Plan Approval; California; Eastern Kern Air Pollution Control District; Stationary Combustion Turbines,"The Environmental Protection Agency (EPA) is proposing to approve a revision to the Eastern Kern Air Pollution Control District (EKAPCD or ""District"") portion of the California State Implementation Plan (SIP). This revision concerns emissions of oxides of nitrogen (NO<INF>X</INF>) from stationary gas turbines. We are proposing to approve a local rule to regulate these emission sources under the Clean Air Act (CAA or ""Act""). We are taking comments on this proposal and plan to follow with a final action.","[{'raw_name': 'ENVIRONMENTAL PROTECTION AGENCY', 'name': 'Environmental Protection Agency', 'id': 145, 'url': 'https://www.federalregister.gov/agencies/environmental-protection-agency', 'json_url': 'https://www.federalregister.gov/api/v1/agencies/145', 'parent_id': None, 'slug': 'environmental-protection-agency'}]",https://www.federalregister.gov/documents/2025/06/20/2025-11281/air-plan-approval-california-eastern-kern-air-pollution-control-district-stationary-combustion
US,Federal Register,2025-06-20,Air Plan Approval; Texas and Oklahoma; Texas Regional Haze Plans for the First and Second Implementation Periods and Five-Year Progress Report; Oklahoma Regional Haze Plan for the First Implementation Period; Extension of Comment Period,"The Environmental Protection Agency (EPA) is extending the comment period for the proposed rule ""Air Plan Approval; Texas and Oklahoma; Texas Regional Haze Plans for the First and Second Implementation Periods and Five-Year Progress Report; Oklahoma Regional Haze Plan for the First Implementation Period"" that was published on May 23, 2025. The proposal provided for a public comment period ending June 23, 2025. The EPA is extending the comment period to July 23, 2025.","[{'raw_name': 'ENVIRONMENTAL PROTECTION AGENCY', 'name': 'Environmental Protection Agency', 'id': 145, 'url': 'https://www.federalregister.gov/agencies/environmental-protection-agency', 'json_url': 'https://www.federalregister.gov/api/v1/agencies/145', 'parent_id': None, 'slug': 'environmental-protection-agency'}]",https://www.federalregister.gov/documents/2025/06/20/2025-11272/air-plan-approval-texas-and-oklahoma-texas-regional-haze-plans-for-the-first-and-second
US,Federal Register,2025-06-18,Air Plan Approval; Texas; Interstate Transport Requirements for the 2010 SO2 NAAQS,"Pursuant to the Federal Clean Air Act (CAA or the Act), the Environmental Protection Agency (EPA) is proposing to approve the portion of the State Implementation Plan (SIP) submittal from the State of Texas demonstrating that the State satisfies the interstate transport requirements, also known as the ""good neighbor"" provision of the Clean Air Act, for the 2010 1-hour sulfur dioxide (SO<INF>2</INF>) primary National Ambient Air Quality Standard (NAAQS). The good neighbor provision requires each State's implementation plan to contain adequate provisions prohibiting the interstate transport of air pollution in amounts that will contribute significantly to nonattainment, or interfere with maintenance, of a NAAQS in any other State.","[{'raw_name': 'ENVIRONMENTAL PROTECTION AGENCY', 'name': 'Environmental Protection Agency', 'id': 145, 'url': 'https://www.federalregister.gov/agencies/environmental-protection-agency', 'json_url': 'https://www.federalregister.gov/api/v1/agencies/145', 'parent_id': None, 'slug': 'environmental-protection-agency'}]",https://www.federalregister.gov/documents/2025/06/18/2025-11270/air-plan-approval-texas-interstate-transport-requirements-for-the-2010-so2-naaqs
US,Federal Register,2025-06-18,Finding of Failure To Attain; Air Plan Approval; Indiana; Huntington County Sulfur Dioxide Attainment Plan,"The Environmental Protection Agency (EPA) is proposing to find that the Huntington County, Indiana nonattainment area failed to attain the 2010 Sulfur Dioxide (SO<INF>2</INF>) National Ambient Air Quality Standard (NAAQS) by the applicable attainment date of April 9, 2023. EPA is also proposing to approve revisions into the Indiana State Implementation Plan (SIP) intended to provide for attainment of the 2010 SO<INF>2</INF> NAAQS for the Huntington County nonattainment area. These SIP submissions include Indiana's attainment demonstration and other planning elements required under the Clean Air Act (CAA), and a Commissioner's Order containing enforceable emission limits. Further, EPA is proposing to find that the provisions of Indiana's SIP submittal adequately provide for attainment of the NAAQS and that the plan meets all other applicable CAA requirements.","[{'raw_name': 'ENVIRONMENTAL PROTECTION AGENCY', 'name': 'Environmental Protection Agency', 'id': 145, 'url': 'https://www.federalregister.gov/agencies/environmental-protection-agency', 'json_url': 'https://www.federalregister.gov/api/v1/agencies/145', 'parent_id': None, 'slug': 'environmental-protection-agency'}]",https://www.federalregister.gov/documents/2025/06/18/2025-11268/finding-of-failure-to-attain-air-plan-approval-indiana-huntington-county-sulfur-dioxide-attainment
US,Federal Register,2025-06-18,Air Quality Plans; Guam; Guam Environmental Protection Agency; New Source Review,"The Environmental Protection Agency (EPA) is proposing approval of a revision to the Guam State Implementation Plan (SIP). This revision governs the Guam Environmental Protection Agency's (GEPA's) issuance of permits for stationary sources and focuses on the preconstruction review and permitting of major sources and major modifications under part D of title I of the Clean Air Act (CAA or ""the Act""). We are taking comments on this proposal and plan to follow with a final action.","[{'raw_name': 'ENVIRONMENTAL PROTECTION AGENCY', 'name': 'Environmental Protection Agency', 'id': 145, 'url': 'https://www.federalregister.gov/agencies/environmental-protection-agency', 'json_url': 'https://www.federalregister.gov/api/v1/agencies/145', 'parent_id': None, 'slug': 'environmental-protection-agency'}]",https://www.federalregister.gov/documents/2025/06/18/2025-11264/air-quality-plans-guam-guam-environmental-protection-agency-new-source-review
US,Federal Register,2025-06-18,Air Plan Approval; Colorado; Serious Attainment Plan RACT Requirements for the 2008 8-Hour Ozone National Ambient Air Quality Standards for the Denver Metro/North Front Range Nonattainment Area,"The Environmental Protection Agency (EPA) is proposing to approve state implementation plan (SIP) submittals under the Clean Air Act (CAA) that address Reasonably Available Control Technology (RACT) requirements for the 2008 ozone National Ambient Air Quality Standards (NAAQS) for the Denver Metro/North Front Range (DMNFR) ozone nonattainment area. The requirements at issue relate to the area's previous Serious nonattainment classification. The EPA is proposing approval of the RACT SIP submittals, proposing to find that the State has met the applicable CAA requirements for Serious area RACT, and proposing that the State has addressed EPA's prior disapproval concerning specific RACT determinations. In this issue of the Federal Register the EPA is concurrently making an interim final determination to defer application of CAA sanctions associated with the prior disapproval. The EPA is taking this action pursuant to the CAA.","[{'raw_name': 'ENVIRONMENTAL PROTECTION AGENCY', 'name': 'Environmental Protection Agency', 'id': 145, 'url': 'https://www.federalregister.gov/agencies/environmental-protection-agency', 'json_url': 'https://www.federalregister.gov/api/v1/agencies/145', 'parent_id': None, 'slug': 'environmental-protection-agency'}]",https://www.federalregister.gov/documents/2025/06/18/2025-11263/air-plan-approval-colorado-serious-attainment-plan-ract-requirements-for-the-2008-8-hour-ozone
